<?xml version="1.0" encoding="UTF-8"?>
<?xml-stylesheet type="text/css" href="style/style.css"?>

<filmy xmlns:xs="http://www.w3.org/2001/XMLSchema-instance"
       xmlns:ga="http://example.org/genres"
       xmlns:kr="http://example.org/countries"
       xs:noNamespaceSchemaLocation="filmy.xsd">

    <dane_techniczne>
        <tytuł>
           Filmoteka
        </tytuł>
        <informacje>Lista filmów w wypożyczalni. Filmy zostały ponumerowane oraz przyporządkowane poprez atrybuty odpowiednim gatunkom i krajom produkcji.</informacje>
        <autorzy>
            <twórca nrIndeksu="224478">Dominik Cegiełka</twórca>
            <twórca nrIndeksu="224546">Kamil Zarych</twórca>
        </autorzy>
    </dane_techniczne>

    <!-- Gatunki filmowe -->
    <gatunki>
        <ga:gatunek gatunek_id="akcja">Akcja</ga:gatunek>
        <ga:gatunek gatunek_id="dokumentalny">Dokumentalny</ga:gatunek>
        <ga:gatunek gatunek_id="dramat">Dramat</ga:gatunek>
        <ga:gatunek gatunek_id="fantasy">Fantasy</ga:gatunek>
        <ga:gatunek gatunek_id="horror">Horror</ga:gatunek>
        <ga:gatunek gatunek_id="komedia">Komedia</ga:gatunek>
        <ga:gatunek gatunek_id="kryminał">Kryminał</ga:gatunek>
        <ga:gatunek gatunek_id="przygodowy">Przygodowy</ga:gatunek>
        <ga:gatunek gatunek_id="thriller">Thriller</ga:gatunek>
        <ga:gatunek gatunek_id="sci-fi">Sci-Fi</ga:gatunek>
        <ga:gatunek gatunek_id="biograficzny">Biograficzny</ga:gatunek>
    </gatunki>

    <!--Kraje produkcji -->
    <kraje>
        <kr:kraj kraj_id="AUS">Australia</kr:kraj>
        <kr:kraj kraj_id="FR">Francja</kr:kraj>
        <kr:kraj kraj_id="PL">Polska</kr:kraj>
        <kr:kraj kraj_id="US">Stany Zjednoczone</kr:kraj>
        <kr:kraj kraj_id="UK">Wielka Brytania</kr:kraj>
        <kr:kraj kraj_id="CA">Kanada</kr:kraj>
        <kr:kraj kraj_id="HK">Hongkong</kr:kraj>
        <kr:kraj kraj_id="BR">Brazylia</kr:kraj>
        <kr:kraj kraj_id="DK">Dania</kr:kraj>
        <kr:kraj kraj_id="SE">Szwecja</kr:kraj>
        <kr:kraj kraj_id="RU">Rosja</kr:kraj>
        <kr:kraj kraj_id="IN">Indie</kr:kraj>
        <kr:kraj kraj_id="RPA">Republika Południowej Afryki</kr:kraj>
        <kr:kraj kraj_id="ES">Hiszpania</kr:kraj>
        <kr:kraj kraj_id="IT">Włochy</kr:kraj>
    </kraje>

    <!-- Lista filmów -->
    <film id="Joker" gatunek="dramat" kraj="CA">
        <bazy_filmowe filmweb="https://www.filmweb.pl/film/Joker-2019-810167" imdb="https://www.imdb.com/title/tt7286456/" />
        <dane>
            <tytuł_org>Joker (2019)</tytuł_org>
            <tytuł_pl></tytuł_pl>
            <opis>Historia jednego z cieszących się najgorszą sławą superprzestępców uniwersum DC — Jokera. Przedstawiony przez Phillipsa obraz śledzi losy kultowego czarnego charakteru, człowieka zepchniętego na margines. To nie tylko kontrowersyjne studium postaci, ale także opowieść ku przestrodze w szerszym kontekście.</opis>
            <reżyseria>Todd Phillips</reżyseria>
            <scenariusz>Todd Phillips, Scott Silver</scenariusz>
            <boxoffice waluta="USD">548 290 190</boxoffice>
        </dane>
         <oceny>
            <filmweb>8.7</filmweb>
            <imdb>8.9</imdb>
        </oceny>
        <premiery>
            <polska>2019-10-04</polska>
            <świat>2019-08-31</świat>
        </premiery>
        <wypożyczenie>
            <data_wypożyczenia>2019-10-08</data_wypożyczenia>
            <data_zwrotu>2019-10-16</data_zwrotu>
        </wypożyczenie>
         <kolejność>
            <numer idNumer="1">/22</numer>
        </kolejność>
    </film>
    <film id="Smith" gatunek="akcja" kraj="US">
        <bazy_filmowe filmweb="https://www.filmweb.pl/Mr.Mrs.Smith" imdb="https://www.imdb.com/title/tt0356910/?ref_=fn_al_tt_1" />
        <dane>
            <tytuł_org>Mr. &amp; Mrs. Smith</tytuł_org>
            <tytuł_pl>Pan i Pani Smith</tytuł_pl>
            <opis>Para płatnych zabójców pracujących dla dwóch tajnych agencji wiedzie monotonne małżeńskie życie. Niespodziewanie dostają zlecenie na siebie nawzajem.</opis>
            <reżyseria>Doug Liman</reżyseria>
            <scenariusz>Simon Kinberg</scenariusz>
            <boxoffice waluta="USD">478 207 520</boxoffice>
        </dane>
         <oceny>
            <filmweb>6.7</filmweb>
            <imdb>6.5</imdb>
        </oceny>
        <premiery>
            <polska>2005-08-05</polska>
            <świat>2005-06-07</świat>
        </premiery>
        <wypożyczenie>
            <data_wypożyczenia>2018-09-08</data_wypożyczenia>
            <data_zwrotu>2018-11-25</data_zwrotu>
        </wypożyczenie>
         <kolejność>
            <numer idNumer="2">/22</numer>
        </kolejność>
    </film>
    <film id="mRycerz" gatunek="sci-fi" kraj="UK">
        <bazy_filmowe filmweb="https://www.filmweb.pl/Mroczny.Rycerz" imdb="https://www.imdb.com/title/tt0468569/" />
        <dane>
            <tytuł_org>The Dark Knight</tytuł_org>
            <tytuł_pl>Mroczny Rycerz</tytuł_pl>
            <opis>Batman, z pomocą porucznika Gordona oraz prokuratora Harveya Denta, występuje przeciwko przerażającemu i nieobliczalnemu Jokerowi, który chce pogrążyć Gotham City w chaosie.</opis>
            <reżyseria>Christopher Nolan</reżyseria>
            <scenariusz>Christopher Nolan, Jonathan Nolan</scenariusz>
            <boxoffice waluta="USD">1 004 558 444</boxoffice>
        </dane>
         <oceny>
            <filmweb>8.0</filmweb>
            <imdb>9.0</imdb>
        </oceny>
        <premiery>
            <polska>2008-08-08</polska>
            <świat>2008-07-14</świat>
        </premiery>
        <wypożyczenie>
            <data_wypożyczenia>2009-02-14</data_wypożyczenia>
            <data_zwrotu>2009-03-01</data_zwrotu>
        </wypożyczenie>
         <kolejność>
            <numer idNumer="3">/22</numer>
        </kolejność>
    </film>
    <film id="Avengers" gatunek="akcja" kraj="US">
        <bazy_filmowe filmweb="https://www.filmweb.pl/film/Avengers%3A+Koniec+gry-2019-790542" imdb="https://www.imdb.com/title/tt4154796/" />
        <dane>
            <tytuł_org>Avengers: Endgame</tytuł_org>
            <tytuł_pl>Avengers: Koniec gry</tytuł_pl>
            <opis>Po wymazaniu połowy życia we Wszechświecie przez Thanosa, Avengersi starają się zrobić wszystko co konieczne, aby pokonać szalonego tytana.</opis>
            <reżyseria>Anthony Russo, Joe Russo</reżyseria>
            <scenariusz>Christopher Markus, Stephen McFeely</scenariusz>
            <boxoffice waluta="USD">2 797 800 564</boxoffice>
        </dane>
         <oceny>
            <filmweb>8.2</filmweb>
            <imdb>8.5</imdb>
        </oceny>
        <premiery>
            <polska>2019-04-25</polska>
            <świat>2019-04-22</świat>
        </premiery>
        <wypożyczenie>
            <data_wypożyczenia>2019-05-06</data_wypożyczenia>
            <data_zwrotu>2019-06-15</data_zwrotu>
        </wypożyczenie>
         <kolejność>
            <numer idNumer="4">/22</numer>
        </kolejność>
    </film>
    <film id="bHero" gatunek="sci-fi"   kraj="US">
        <bazy_filmowe filmweb="https://www.filmweb.pl/Mroczny.Rycerz" imdb="https://www.imdb.com/title/tt2245084/" />
        <dane>
            <tytuł_org>Big Hero 6</tytuł_org>
            <tytuł_pl>Wielka Szóstka</tytuł_pl>
            <opis>Młody geniusz Hiro Hamada wraz ze swoim robotem Baymaxem zostaje uwikłany w plan zniszczenia miasta San Fransokyo.</opis>
            <reżyseria>Don Hall, Chris Williams</reżyseria>
            <scenariusz>Jordan Roberts, Robert L. Baird,</scenariusz>
            <boxoffice waluta="USD">652 127 828</boxoffice>
        </dane>
         <oceny>
            <filmweb>7.7</filmweb>
            <imdb>7.8</imdb>
        </oceny>
        <premiery>
            <polska>2014-11-28</polska>
            <świat>2014-10-23</świat>
        </premiery>
        <wypożyczenie>
            <data_wypożyczenia>2015-12-12</data_wypożyczenia>
            <data_zwrotu>2015-12-27</data_zwrotu>
        </wypożyczenie>
         <kolejność>
            <numer idNumer="5">/22</numer>
        </kolejność>
    </film>
    <film id="Wonder" gatunek="dramat"  kraj="HK">
        <bazy_filmowe filmweb="https://www.filmweb.pl/film/Cudowny+ch%C5%82opak-2017-776387" imdb="https://www.imdb.com/title/tt2543472/" />
        <dane>
            <tytuł_org>Wonder</tytuł_org>
            <tytuł_pl>Cudowny chłopak</tytuł_pl>
            <opis>Auggie od urodzenia ma zdeformowaną twarz. W nowej szkole chłopiec chce udowodnić rówieśnikom, że piękno to więcej niż wygląd.</opis>
            <reżyseria>Stephen Chbosky</reżyseria>
            <scenariusz>Steve Conrad, Jack Thorne</scenariusz>
            <boxoffice waluta="USD">305 900 041</boxoffice>
        </dane>
         <oceny>
            <filmweb>7.9</filmweb>
            <imdb>8.0</imdb>
        </oceny>
        <premiery>
            <polska>2018-01-19</polska>
            <świat>2017-11-15</świat>
        </premiery>
        <wypożyczenie>
            <data_wypożyczenia>2019-04-22</data_wypożyczenia>
            <data_zwrotu>2019-08-19</data_zwrotu>
        </wypożyczenie>
         <kolejność>
            <numer idNumer="6">/22</numer>
        </kolejność>
    </film>
    <film id="Exorcist" gatunek="horror"  kraj="US">
        <bazy_filmowe filmweb="https://www.filmweb.pl/film/Cudowny+ch%C5%82opak-2017-776387" imdb="https://www.imdb.com/title/tt2543472/" />
        <dane>
            <tytuł_org>The Exorcist</tytuł_org>
            <tytuł_pl>Egzorcysta</tytuł_pl>
            <opis>Kiedy dwunastoletnia dziewczynka zostaje opętana przez diabła, a lekarze nie są w stanie jej pomóc, przerażona matka kontaktuje się z egzorcystą.</opis>
            <reżyseria>William Friedkin</reżyseria>
            <scenariusz>William Peter, Blatty</scenariusz>
            <boxoffice waluta="USD">441 306 145</boxoffice>
        </dane>
        <oceny>
            <filmweb>7.5</filmweb>
            <imdb>8.0</imdb>
        </oceny>